<?xml version="1.0" encoding="UTF-8"?>
<n:morphml xmlns:n="http://morphml.org/morphml/schema/1.0.0" 
    xmlns:xsi="http://www.w3.org/2001/XMLSchema-instance" 
    xsi:schemaLocation="http://morphml.org/morphml/schema/1.0.0 
                        ../../Schemata/MorphML/v1.1/MorphML_v1.1.xsd">
                        
                        
<n:name>Old version SimpleCell</n:name>
<n:notes>A Simple cell as generated by neuroConstruct, which is good for the v1.1 specification</n:notes>


<n:lengthUnits>Micrometers</n:lengthUnits>
<!--Converting cell: SimpleCell-->
<n:points>

<!--   Start point of segment: Soma, ID: 0-->
<n:point>
<n:id>0</n:id>
<!--First segment in new section-->
<n:x>0.0</n:x>
<n:y>0.0</n:y>
<n:z>0.0</n:z>
<n:diameter>16</n:diameter>
</n:point>

<!--   End point of segment: Soma, ID: 0-->
<n:point>
<n:id>1</n:id>
<n:x>0.0</n:x>
<n:y>0.0</n:y>
<n:z>0</n:z>
<n:diameter>16</n:diameter>
</n:point>

<!--   Start point of segment: mainDend1, ID: 1-->
<n:point>
<n:id>2</n:id>
<!--First segment in new section-->
<n:x>0.0</n:x>
<n:y>0.0</n:y>
<n:z>0.0</n:z>
<n:diameter>2</n:diameter>
</n:point>

<!--   End point of segment: mainDend1, ID: 1-->
<n:point>
<n:id>3</n:id>
<n:x>-10.0</n:x>
<n:y>-30.0</n:y>
<n:z>0</n:z>
<n:diameter>2</n:diameter>
</n:point>

<!--   Start point of segment: mainDend2, ID: 2-->
<n:point>
<n:id>4</n:id>
<!--First segment in new section-->
<n:x>0.0</n:x>
<n:y>0.0</n:y>
<n:z>0.0</n:z>
<n:diameter>2</n:diameter>
</n:point>

<!--   End point of segment: mainDend2, ID: 2-->
<n:point>
<n:id>5</n:id>
<n:x>10.0</n:x>
<n:y>-30.0</n:y>
<n:z>0</n:z>
<n:diameter>2</n:diameter>
</n:point>

<!--   Start point of segment: mainAxon, ID: 3-->
<n:point>
<n:id>6</n:id>
<!--First segment in new section-->
<n:x>0.0</n:x>
<n:y>0.0</n:y>
<n:z>0.0</n:z>
<n:diameter>2</n:diameter>
</n:point>

<!--   End point of segment: mainAxon, ID: 3-->
<n:point>
<n:id>7</n:id>
<n:x>0.0</n:x>
<n:y>20.0</n:y>
<n:z>0</n:z>
<n:diameter>2</n:diameter>
</n:point>

<!--   Start point of segment: subAxon1, ID: 4-->
<n:point>
<n:id>8</n:id>
<!--First segment in new section-->
<n:x>0.0</n:x>
<n:y>20.0</n:y>
<n:z>0.0</n:z>
<n:diameter>2</n:diameter>
</n:point>

<!--   End point of segment: subAxon1, ID: 4-->
<n:point>
<n:id>9</n:id>
<n:x>0.0</n:x>
<n:y>30.0</n:y>
<n:z>10</n:z>
<n:diameter>2</n:diameter>
</n:point>

<!--   Start point of segment: subAxon2, ID: 5-->
<n:point>
<n:id>10</n:id>
<!--First segment in new section-->
<n:x>0.0</n:x>
<n:y>20.0</n:y>
<n:z>0.0</n:z>
<n:diameter>2</n:diameter>
</n:point>

<!--   End point of segment: subAxon2, ID: 5-->
<n:point>
<n:id>11</n:id>
<n:x>0.0</n:x>
<n:y>30.0</n:y>
<n:z>-10</n:z>
<n:diameter>2</n:diameter>
</n:point>
</n:points>


<n:cells>
<n:cell>
<n:name>SimpleCell</n:name>
<!--   Segments of the cell   -->
<n:segments>

<!--   Segment: Soma, ID: 0-->
<n:segment>
<n:id>0</n:id>
<n:proximal>0</n:proximal>
<n:distal>1</n:distal>
</n:segment>

<!--   Segment: mainDend1, ID: 1-->
<n:segment>
<n:id>1</n:id>
<n:proximal>2</n:proximal>
<n:distal>3</n:distal>
<n:parent>0</n:parent>
</n:segment>

<!--   Segment: mainDend2, ID: 2-->
<n:segment>
<n:id>2</n:id>
<n:proximal>4</n:proximal>
<n:distal>5</n:distal>
<n:parent>0</n:parent>
</n:segment>

<!--   Segment: mainAxon, ID: 3-->
<n:segment>
<n:id>3</n:id>
<n:proximal>6</n:proximal>
<n:distal>7</n:distal>
<n:parent>0</n:parent>
</n:segment>

<!--   Segment: subAxon1, ID: 4-->
<n:segment>
<n:id>4</n:id>
<n:proximal>8</n:proximal>
<n:distal>9</n:distal>
<n:parent>3</n:parent>
</n:segment>

<!--   Segment: subAxon2, ID: 5-->
<n:segment>
<n:id>5</n:id>
<n:proximal>10</n:proximal>
<n:distal>11</n:distal>
<n:parent>3</n:parent>
</n:segment>
</n:segments>
</n:cell>
</n:cells>
</n:morphml>
